{
  "$schema": "https://json-schema.org/draft/2020-12/schema",
  "$id": "https://aicontrolcenter.local/schemas/mac-service-manifest.schema.json",
  "title": "AIControlCenter Mac Service Manifest",
  "type": "object",
  "additionalProperties": false,
  "required": [
    "schema_version",
    "profile",
    "control_plane",
    "services"
  ],
  "properties": {
    "schema_version": {
      "type": "string",
      "const": "1.0"
    },
    "profile": {
      "type": "string",
      "minLength": 1
    },
    "control_plane": {
      "type": "object",
      "additionalProperties": false,
      "required": [
        "host_role",
        "required",
        "ubuntu_dependency"
      ],
      "properties": {
        "host_role": {
          "type": "string",
          "const": "brain"
        },
        "required": {
          "type": "boolean",
          "const": true
        },
        "ubuntu_dependency": {
          "type": "boolean",
          "const": false
        }
      }
    },
    "services": {
      "type": "array",
      "minItems": 1,
      "items": {
        "$ref": "#/$defs/service"
      }
    }
  },
  "$defs": {
    "service": {
      "type": "object",
      "additionalProperties": true,
      "required": [
        "service_id",
        "logical_id",
        "runtime_health",
        "role",
        "owner",
        "required",
        "production_status",
        "runtime",
        "supervisor",
        "lifecycle",
        "ubuntu_dependency",
        "state_policy"
      ],
      "properties": {
        "service_id": {
          "type": "string",
          "pattern": "^[a-z0-9][a-z0-9-]*$"
        },
        "logical_id": {
          "type": "string",
          "pattern": "^[a-z0-9][a-z0-9-]*$"
        },
        "runtime_health": {
          "type": "boolean"
        },
        "role": {
          "type": "string",
          "minLength": 1
        },
        "owner": {
          "type": "string",
          "minLength": 1
        },
        "required": {
          "type": "boolean"
        },
        "production_status": {
          "type": "string",
          "enum": [
            "PRODUCTION",
            "OPTIONAL_UNAVAILABLE_ALLOWED",
            "NOT_RUNNING",
            "NOT_DEPLOYED"
          ]
        },
        "runtime": {
          "type": "string",
          "minLength": 1
        },
        "supervisor": {
          "type": "string",
          "minLength": 1
        },
        "lifecycle": {
          "type": "string",
          "enum": [
            "launchd",
            "embedded",
            "external",
            "unmanaged",
            "not_deployed"
          ]
        },
        "launchd_label": {
          "type": "string",
          "minLength": 1
        },
        "listen_host": {
          "type": "string",
          "minLength": 1
        },
        "port": {
          "type": "integer",
          "minimum": 1,
          "maximum": 65535
        },
        "health_endpoint": {
          "type": "string",
          "pattern": "^/"
        },
        "ubuntu_dependency": {
          "type": "boolean"
        },
        "state_policy": {
          "type": "string",
          "minLength": 1
        },
        "powered_off_allowed": {
          "type": "boolean"
        },
        "service_platform": {
          "$ref": "#/$defs/servicePlatform"
        }
      },
      "allOf": [
        {
          "if": {
            "properties": {
              "lifecycle": {
                "const": "launchd"
              }
            },
            "required": [
              "lifecycle"
            ]
          },
          "then": {
            "required": [
              "launchd_label"
            ]
          },
          "else": {
            "not": {
              "required": [
                "launchd_label"
              ]
            }
          }
        },
        {
          "if": {
            "properties": {
              "lifecycle": {
                "const": "not_deployed"
              }
            },
            "required": [
              "lifecycle"
            ]
          },
          "then": {
            "properties": {
              "production_status": {
                "const": "NOT_DEPLOYED"
              }
            }
          }
        }
      ]
    },
    "servicePlatform": {
      "type": "object",
      "additionalProperties": false,
      "required": [
        "application_entrypoint",
        "immutable_runtime",
        "log_parent",
        "logs",
        "health_observation",
        "lifecycle_capabilities",
        "lifecycle_planning"
      ],
      "properties": {
        "application_entrypoint": {
          "type": "string",
          "minLength": 1
        },
        "health_observation": {
          "enum": [
            "launchd",
            "heartbeat"
          ]
        },
        "lifecycle_capabilities": {
          "const": [
            "inspect"
          ]
        },
        "lifecycle_planning": {
          "type": "object",
          "additionalProperties": false,
          "required": [
            "bounded_action",
            "eligible_statuses"
          ],
          "properties": {
            "bounded_action": {
              "const": "bootstrap"
            },
            "eligible_statuses": {
              "const": [
                "NOT_DEPLOYED"
              ]
            }
          }
        },
        "immutable_runtime": {
          "type": "object",
          "additionalProperties": false,
          "required": [
            "runtime_root"
          ],
          "properties": {
            "runtime_root": {
              "type": "string",
              "pattern": "^/"
            }
          }
        },
        "log_parent": {
          "type": "object",
          "additionalProperties": false,
          "required": [
            "path",
            "type",
            "mode",
            "owner",
            "group"
          ],
          "properties": {
            "path": {
              "type": "string",
              "pattern": "^/"
            },
            "type": {
              "const": "directory"
            },
            "mode": {
              "type": "integer",
              "minimum": 0,
              "maximum": 4095
            },
            "owner": {
              "type": "string",
              "minLength": 1
            },
            "group": {
              "type": "string",
              "minLength": 1
            }
          }
        },
        "logs": {
          "type": "array",
          "minItems": 1,
          "uniqueItems": true,
          "items": {
            "type": "object",
            "additionalProperties": false,
            "required": [
              "path",
              "type",
              "mode",
              "owner",
              "group"
            ],
            "properties": {
              "path": {
                "type": "string",
                "pattern": "^/"
              },
              "type": {
                "const": "file"
              },
              "mode": {
                "type": "integer",
                "minimum": 0,
                "maximum": 4095
              },
              "owner": {
                "type": "string",
                "minLength": 1
              },
              "group": {
                "type": "string",
                "minLength": 1
              }
            }
          }
        }
      }
    }
  }
}
